address,area,city,detail,lat,lng,name,province,street_id,telephone,uid
北京市昌平区回龙观东大街天龙苑25号楼1层,昌平区,北京市,1,40.086809,116.361097,中国农业银行(北京回龙观东区支行),北京市,af35533f3fff5bdbc9c3db68,,af35533f3fff5bdbc9c3db68
百沙路青年创业大厦a座,昌平区,北京市,1,40.156006,116.298178,中国农业银行(北京沙河支行),北京市,383c3bb43897195a1b11d587,,383c3bb43897195a1b11d587
北京市昌平区南口镇交通街87号东侧1幢等8幢,昌平区,北京市,1,40.244993,116.135736,中国农业银行(北京南口支行),北京市,0622ea0b0478e27cc6effb16,(010)69771428,0622ea0b0478e27cc6effb16
北京市昌平区念头工业区,昌平区,北京市,1,40.189477,116.176451,中国农业银行(北京念头支行),北京市,50f7d1461e7409c472210b0d,(010)60755754,50f7d1461e7409c472210b0d
北京市昌平区东小口镇霍营新村西新晨商场东侧1号1层,昌平区,北京市,1,40.081122,116.374396,中国农业银行(北京霍营支行),北京市,2e00c5dd58898c1cd7851f63,(010)69797884,2e00c5dd58898c1cd7851f63
北京市昌平区府学路29号阳光商厦F1,昌平区,北京市,1,40.227292,116.249986,中国农业银行(东环分理处),北京市,9ee7cc78f14dbc7016c9050d,(010)89701423,9ee7cc78f14dbc7016c9050d
北京市昌平区阳坊村西大街59号1幢等5幢,昌平区,北京市,1,40.147033,116.148546,中国农业银行(北京阳坊支行),北京市,5d34467e0d43d2e25fbe8639,,5d34467e0d43d2e25fbe8639
北京市昌平区北七家镇八仙庄村翔鸿科技孵化基地10号,昌平区,北京市,1,40.126609,116.429205,中国农业银行(北京北七家支行),北京市,7c5e480bc696d1c9adb22a55,(010)89759238,7c5e480bc696d1c9adb22a55
北京市昌平区南环东路东关南里小区31号楼1至3层商业楼,昌平区,北京市,1,40.219538,116.254872,中国农业银行(北京东关南里支行),北京市,cc788fde045f2e8a88fc060d,(010)89709008,cc788fde045f2e8a88fc060d
北京市昌平区东小口镇天通苑五区30号楼,昌平区,北京市,1,40.070473,116.420688,中国农业银行(北京天通西苑支行),北京市,669775d0a39eed5bfd0eb01d,(010)84842897,669775d0a39eed5bfd0eb01d
北京市昌平区顺沙路小汤山镇西口路南(网通营业厅西侧),昌平区,北京市,1,40.18182,116.392483,中国农业银行(北京小汤山支行),北京市,0dc3d82d4b0eb06c75e5b608,(010)61781282,0dc3d82d4b0eb06c75e5b608
北京市昌平区北七家镇天通苑东苑二区1号楼16-17门,昌平区,北京市,1,40.074105,116.443826,中国农业银行(北京天通东苑支行),北京市,75d0881a0263c54d3a04b11d,"(010)61747344,(010)61747343",75d0881a0263c54d3a04b11d
北京市昌平区天通苑东苑一区33号楼11单元,昌平区,北京市,1,40.071955,116.439036,中国农业银行(北京天通苑东一区支行),北京市,6ea5863ffe7badf621022008,(010)80124253,6ea5863ffe7badf621022008
北京市昌平区西环路25号蓝郡嘉苑底商,昌平区,北京市,1,40.225534,116.233146,中国农业银行(北京昌平支行营业部),北京市,bd1717df2f117681a8175a45,(010)69742069,bd1717df2f117681a8175a45
中关村南大街27号中国民族大学附近,昌平区,北京市,1,40.221069,116.239074,中国农业银行24小时自助银行(商业街),北京市,87a4fe06e02cf62532870a65,,87a4fe06e02cf62532870a65
北京市昌平区阳坊镇昌流路南(马池口镇中心幼儿园东北200米),昌平区,北京市,1,40.191566,116.193069,中国农业银行24小时自助银行(马池口红冶家属院东),北京市,4eb3b5339500b90843024551,,4eb3b5339500b90843024551
天龙苑25,昌平区,北京市,1,40.083359,116.332718,中国农业银行24小时自助银行(北京回龙观支行),北京市,edd64ce1a66799913fe23163,,edd64ce1a66799913fe23163
北京市昌平区延寿镇昭陵环陵路定陵博物馆,昌平区,北京市,1,40.300043,116.234549,中国农业银行ATM(环陵路),北京市,,,39c93770a7d42c401df74d66
北京市昌平区沙河富生路巩华新村附近,昌平区,北京市,1,40.122616,116.265252,中国农业银行ATM(富生路),北京市,,,5cf68a611968d134f50e77a6
邻近温南路,昌平区,北京市,1,40.215957,116.124899,中国农业银行24小时自助银行,北京市,4f6bbf975e1bf7680d0e6b62,,4f6bbf975e1bf7680d0e6b62
北京市昌平区天通东苑一区33,昌平区,北京市,1,40.071704,116.439733,中国农业银行24小时自助银行服务(太平庄中街),北京市,7780fcacd896549a07026f37,,7780fcacd896549a07026f37
北京市昌平区流星花园三区39号,昌平区,北京市,1,40.095242,116.347272,中国农业银行24小时自助银行(北京流星花园支行),北京市,0cceca93a7c82737873304ca,,0cceca93a7c82737873304ca
北京市昌平区格林豪泰酒店(北七家立汤路店),昌平区,北京市,1,40.134353,116.417189,中国农业银行24小时自助银行(立汤路),北京市,,,03bfe83739b446cb4207c1e2
北京市昌平区小汤山顺沙路龙脉温泉度假村南门,昌平区,北京市,1,40.186274,116.406469,中国农业银行24小时自助银行(富来宫温泉公寓西),北京市,,,48eb0058d043d6d02fe67b50
北京市昌平区东小口镇霍营新村西新晨商场东侧1号1层1-1,昌平区,北京市,1,40.081118,116.374323,中国农业银行24小时自助银行(北京霍营支行),北京市,f4460918f1d7286ab11e3663,,f4460918f1d7286ab11e3663
白浮泉路10号2号楼(北控科技大厦一层),昌平区,北京市,1,40.205311,116.241337,中国农业银行24小时自助银行(白浮泉路北控科技大厦科技园区分理处),北京市,1f10aee373cba2758605bf87,,1f10aee373cba2758605bf87
沙河镇百沙路青年创业大厦,昌平区,北京市,1,40.155705,116.298237,中国农业银行24小时自助银行(北京沙河支行),北京市,,,52185dbb3266a87995031980
天通苑5区30号楼,昌平区,北京市,1,40.070326,116.420676,中国农业银行24小时自助银行服务(天通苑),北京市,06211e3ff9e158ff5e17c3ad,,06211e3ff9e158ff5e17c3ad
北京市昌平区小汤山镇西口路南,昌平区,北京市,1,40.181911,116.392455,中国农业银行24小时自助银行(北京小汤山分行),北京市,e889a744b54f60b58605bf08,,e889a744b54f60b58605bf08
北京市昌平区府学路18号中国石油大学北京分部,昌平区,北京市,1,40.226804,116.253712,中国农业银行24小时自助银行(昌平东环分理处),北京市,e43340df3b0313dcbda2407b,,e43340df3b0313dcbda2407b
北京市昌平区西环路25号蓝郡嘉苑25号13号楼,昌平区,北京市,1,40.225518,116.233081,中国农业银行24小时自助银行(北京昌平支行营业室),北京市,00d8bdb5cd0c1640dbeced23,,00d8bdb5cd0c1640dbeced23
北京市昌平区沙河巩华家园西二村(丰善东路),昌平区,北京市,1,40.151324,116.290873,中国农业银行24小时自助银行服务(丰善东路),北京市,94333be2327a91b9b6147fa1,,94333be2327a91b9b6147fa1
北京市昌平区西三旗中腾建华商务大厦,昌平区,北京市,1,40.064426,116.342541,中国农业银行24小时自助银行服务(西三旗支行),北京市,8c1c835e7826942f1894c665,,8c1c835e7826942f1894c665
北京市昌平区北七家镇宏福苑A号楼底商,昌平区,北京市,1,40.118393,116.37794,中国农业银行24小时自助银行服务(宏福分理处),北京市,faee4efb934011822fe67bd8,,faee4efb934011822fe67bd8
城南街道南口路29号乐多港奥特莱斯购物中心1F层,昌平区,北京市,1,40.237829,116.196168,中国农业银行24小时自助银行(乐多港奥特莱斯购物中心),北京市,1bfe2d2ffc5513164d2fdfba,,1bfe2d2ffc5513164d2fdfba
昌平区西环路6号,昌平区,北京市,1,40.23383,116.233372,中国农业银行24小时自助银行服务(昌平镇西环路),北京市,60ec8e23f7df3c8d7ab55c65,,60ec8e23f7df3c8d7ab55c65
北京市昌平区京藏高速辅路,昌平区,北京市,1,40.12534,116.278499,中国农业银行24小时自助银行(沙河医院南),北京市,ad0737c30f646fb3f60e775f,,ad0737c30f646fb3f60e775f
北京市昌平区北七家镇八仙庄村翔鸿科技孵化基地10号,昌平区,北京市,1,40.126502,116.42917,中国农业银行24小时自助银行(北七家镇工业园),北京市,923ffd009818cccad92f2855,,923ffd009818cccad92f2855
北京市昌平区昌平镇东关南里小区31号楼1至3层,昌平区,北京市,1,40.219559,116.254996,中国农业银行24小时自助银行服务(北京东关南里支行),北京市,a1418eb42dcd5301ebe58273,,a1418eb42dcd5301ebe58273
北京市昌平区南环路化工大学院内,昌平区,北京市,1,40.220672,116.259991,中国农业银行24小时自助银行(南环路化工大学院内),北京市,,,122c6e4e4633bca203ff2d5b
天龙苑25,昌平区,北京市,1,40.08682,116.361228,中国农业银行24小时自助银行(北京回龙观东区支行),北京市,12db099aa70291fda7da39e3,,12db099aa70291fda7da39e3
北京市昌平区阳坊镇西大街59号阳坊分理处,昌平区,北京市,1,40.147063,116.148536,中国农业银行24小时自助银行服务(北京阳坊分理处),北京市,25ec69fc595a547dc26c141f,,25ec69fc595a547dc26c141f
北京市昌平区北七家镇天通苑东苑二区1号楼16-17门,昌平区,北京市,1,40.074179,116.443804,中国农业银行24小时自助银行服务(北京天通东苑支行),北京市,e3082848bd5211bfb34c491c,,e3082848bd5211bfb34c491c
北京市昌平区马池口镇念头工业区,昌平区,北京市,1,40.189392,116.176613,中国农业银行24小时自助银行(念头支行),北京市,60df9df96bdea6bc0ab93aef,,a47d29905561ac3ec8c3db5e
北京市昌平区鼓楼南街17号新世纪商城5层,昌平区,北京市,1,40.22461,116.2398,ABC(新世纪商城店),北京市,c1296cf1a1ab97f8f7b916d3,,c1296cf1a1ab97f8f7b916d3
