address,area,city,detail,lat,lng,name,province,street_id,telephone,uid
深圳市福田区中心四路嘉里建设广场-3座,福田区,深圳市,1,22.54089,114.063448,汇丰银行(深圳福田中心区支行),广东省,1b5f6e8862e8f17fb64f5481,"4008203090,(0755)25138636",1b5f6e8862e8f17fb64f5481
深圳市福田区华强北路4002号长兴大厦首层北区01号商铺、B层6楼全层,福田区,深圳市,1,22.556091,114.09401,汇丰银行(深圳华强北路支行),广东省,f5ae5f4d1a4b072843afe6fa,"(0755)25138666,(0755)25138699",0058610833bf01a546e27436
深圳市福田区深南西路车公庙工业区天安数码时代大厦副楼101,福田区,深圳市,1,22.540975,114.039045,汇丰银行(深圳天安数码城支行),广东省,b490f076d9c60dbbb2077d73,4008203090,b490f076d9c60dbbb2077d73
深圳市福田区中心四路1-1号嘉里建设广场第三座裙楼第1层03D室,福田区,深圳市,1,22.540718,114.063869,汇丰银行24小时自助银行(深圳福田中心区支行),广东省,6bb8435945079d54b21e364e,,6bb8435945079d54b21e364e
泰然四路2,福田区,深圳市,1,22.540939,114.03914,汇丰银行ATM(深圳天安数码城支行),广东省,d84f2e382270b31872455bfc,,d84f2e382270b31872455bfc
